"King's Indian Defense: Fianchetto Variation, Simagin Variation",1
"Alekhine Defense: Modern Variation, Panov Variation",1
"Italian Game: Two Knights Defense, Max Lange Attack, Krause Variation",1
Queen's Indian Defense: Fianchetto Traditional,1
"Sicilian Defense: Hyperaccelerated Pterodactyl, Exchange Variation",1
"Caro-Kann Defense: Advance Variation, Van der Wiel Attack, Dreyev Defense",1
"Ruy Lopez: Open, 6.d4",1
Irish Gambit,1
"Philidor Defense: Nimzowitsch Variation, Rellstab Variation",1
Russian Game: Kaufmann Attack,1
"Sicilian Defense: Smith-Morra Gambit Accepted, Morphy Defense",1
Sicilian Defense: Venice Attack,1
Queen's Gambit Declined: Westphalian Variation,1
"King's Gambit: Panteldakis Countergambit, Symmetrical Variation",1
"Sicilian Defense: Najdorf Variation, Dekker Gambit",1
Bogo-Indian Defense: Haiti Variation,1
"French Defense: Classical Variation, Richter Attack",1
Queen's Gambit Declined: Cambridge Springs Defense: 7.cxd5,1
"Queen's Gambit Declined: Orthodox Defense, Main Line",1
Polish Opening: Wolferts Gambit,1
"Queen's Gambit Declined: Tartakower Variation, Exchange Variation",1
Queen's Pawn Game: Englund Gambit,1
"Sicilian Defense: Wing Gambit, Abrahams Variation",1
"Sicilian Defense: Dragon, Classical, Grigoriev Variation",1
Old Indian Defense: Normal Variation,1
"Ruy Lopez: Morphy Defense, Mackenzie Variation",1
Owen Defense: Wind Gambit,1
Slav Defense: Breyer Variation,1
"Ruy Lopez: Schliemann Defense, Moehring Variation",1
"Englund Gambit Complex Declined, Diemer Counterattack",1
"English Opening: Symmetrical Variation, Three Knights Variation",1
Polish Opening: Zukertort System,1
"Queen's Pawn Game: Veresov Attack, Two Knights System, Gruenfeld Defense",1
"Vienna Game: Vienna Gambit, Pierce Gambit",1
"Benko Gambit Accepted, Fully Accepted Variation",1
"Ruy Lopez: Closed Variations, Bogoljubov Variation",1
"Queen's Indian Defense: Fianchetto Variation, Saemisch Variation",1
"King's Gambit Accepted, Kieseritzky Gambit, Brentano Defense",1
"Vienna Game: Vienna Gambit, Quelle Gambit",1
"Italian Game: Two Knights Defense, Maroczy Variation",1
Sicilian Defense: Grob Variation,1
Latvian Gambit: Greco Variation,1
"Sicilian Defense: Nimzowitsch Variation, Main Line",1
"French Defense: MacCutcheon Variation, Chigorin Variation",1
"Nimzo-Indian Defense: Normal Variation, Bishop Attack, Classical Defense",1
"Sicilian Defense: Najdorf Variation, Opocensky Variation, Traditional Line",1
King's Pawn Game: Schulze-Mueller Gambit,1
"French Defense: Tarrasch Variation, Pawn Center Variation",1
"Pterodactyl Defense: Eastern, Pterodactyl",1
Tarrasch Defense: Classical Variation,1
Bronstein Gambit,1
"Sicilian Defense: O'Kelly Variation, Reti System",1
Benoni Defense: Czech Benoni Defense,1
"Nimzowitsch Defense: Scandinavian Variation, Aachen Gambit",1
Queen's Gambit Accepted: Alekhine Defense,1
"Sicilian Defense: Classical Variation, Fianchetto Variation",1
"Nimzo-Indian Defense: Normal Variation, Schlechter Defense",1
"Russian Game: Classical Attack, Chigorin Variation, Main Line",1
"King's Indian Defense: Orthodox Variation, Positional Defense",1
"King's Gambit Accepted, Rosentreter-Testa Gambit",1
"Reti Opening: Anglo-Slav Variation, Capablanca Variation",1
French Defense: Franco-Hiva Gambit I Accepted,1
"King's Indian Defense: Saemisch Variation, Closed Variation",1
Scandinavian Defense: Portuguese Variation,1
Englund Gambit Complex: Zilbermints Gambit,1
"Italian Game: Evans Gambit, McDonnell Defense, Main Line",1
"Benoni Defense: Classical Variation, New York Variation",1
"Alekhine Defense: Modern Variation, Alekhine Variation",1
"French Defense: Rubinstein Variation, Kasparov Attack",1
"Benoni Defense: Four Pawns Attack, Main Line",1
French Defense: Henneberger Variation,1
"Queen's Gambit Accepted: Central Variation, Rubinstein Defense, Yefimov Gambit",1
"Ruy Lopez: Berlin Defense, l'Hermet Variation",1
"Scandinavian Defense: Anderssen Counterattack, Orthodox Attack",1
"Italian Game: Two Knights Defense, Blackburne Variation",1
"Englund Gambit Declined, Reversed Brooklyn",1
"King's Indian, Fianchetto, Classical Variation, 8.e4",1
St. George Defense: Zilbermints Gambit,1
"Sicilian Defense: Closed Variation, Korchnoi Defense",1
"King's Gambit, Falkbeer Countergambit, Pickler Gambit",1
Pirc Defense: Austrian Attack #2,1
"Italian Game: Evans Gambit, Lasker Defense",1
"Ruy Lopez: Closed Variations, Breyer Defense",1
"Nimzo-Indian Defense: Classical Variation, Keres Defense",1
Semi-Slav Defense: Semi-Meran Variation,1
Queen's Indian Defense: Anti-Queen's Indian System,1
Bishop's Opening: Warsaw Gambit,1
Rat Defense: Spike Attack,1
"Caro-Kann Defense: Classical Variation, Lobron System",1
"Italian Game: Giuoco Piano, Aitken Variation",1
King's Gambit Accepted: Ghulam-Kassim Gambit #2,1
"Ruy Lopez: Closed Variations, Closed Defense #2",1
"Reti Opening: Anglo-Slav Variation, Bogoljubov Variation, III",1
"Ruy Lopez: Open, 6.d4 b5",1
"Sicilian Defense: Smith-Morra Gambit Declined, Dubois Variation",1
"Sicilian Defense: Smith-Morra Gambit Accepted, Larsen Defense",1
"French Defense: Classical Variation, Tartakower Variation",1
Queen's Gambit Declined: Anti-Tartakower Variation,1
"Ruy Lopez: Closed Variations, Worrall Attack, Castling Line",1
Modern Defense: Improved Maroczy,1
"Benko Gambit Accepted, Dlugy Variation",1
"Gruenfeld Defense: Three Knights Variation, Vienna Variation",1
"Queen's Pawn Game: Veresov Attack, Two Knights System",1
Sicilian Defense: Kveinis Variation,1
"Ruy Lopez: Closed Variations, Center Attack",1
Gruenfeld Defense: Lutikov Variation,1
"Sicilian Defense: Kan Variation, Polugaevsky Variation",1
Alekhine Defense: O'Sullivan Gambit,1
"Ruy Lopez: Closed Variations, Balla Variation",1
"Nimzo-Indian Defense: Normal Variation, Gligoric System, Bernstein Defense",1
Budapest Defense: Fajarowicz-Steiner Variation,1
"Philidor Defense: Philidor Countergambit, del Rio Attack",1
"Ponziani Opening: Ponziani Countergambit, Schmidt Attack",1
"Ruy Lopez: Closed Variations, Keres Defense #2",1
Horwitz Defense: Zilbermints Gambit,1
"Sicilian Defense: Accelerated Dragon, Maroczy Bind, Gurgenidze Variation",1
Scandinavian Defense: Richter Variation,1
"Nimzo-Indian Defense: Leningrad Variation, Benoni Defense",1
Benoni Defense: Woozle,1
King's Indian Defense: Petrosian Variation,1
Queen's Gambit Accepted: Schwartz Defense,1
"Sicilian Defense: Najdorf Variation, Scheveningen Variation",1
Ware Defense: Snagglepuss Defense,1
Caro-Kann Defense: Ulysses Gambit,1
"King's Gambit Accepted, Kieseritzky Gambit, Cotter Gambit",1
"Caro-Kann Defense: Panov Attack, Fianchetto Defense, Fianchetto Gambit",1
Zukertort Opening: Herrstrom Gambit,1
Richter-Veresov Attack #2,1
"King's Gambit Accepted: Bishop's Gambit, Bledow Variation",1
"English Opening: King's English Variation, Four Knights Variation, Flexible Line",1
"Sicilian Defense: Dragon Variation, Yugoslav Attack, Soltis Variation",1
"Queen's Gambit Accepted: Classical Defense, Main Line",1
"French Defense: Advance Variation, Ruisdonk Gambit",1
"Philidor Defense: Hanham, Kmoch Variation",1
"Queen's Gambit Refused: Chigorin Defense, Exchange Variation, Costa's Line",1
"King's Gambit: Panteldakis Countergambit, Schiller's Defense",1
"King's Gambit Accepted: Allgaier, Schlechter Defense",1
Grob Opening: Double Grob,1
"Italian Game: Scotch Gambit, Anderssen Attack, Main Line",1
"Queen's Gambit Accepted: Alekhine Defense, Borisenko-Furman Variation",1
"Gruenfeld Defense: Russian Variation, Accelerated Variation",1
"Catalan Opening: Open Defense, Modern Sharp Variation",1
Benko Gambit: Zaitsev System,1
"Queen's Gambit Accepted: Classical Defense, Normal Line",1
"Ruy Lopez: Marshall Attack, Modern Variation",1
"Russian Game: Classical Attack, Jaenisch Variation",1
"Nimzo-Indian Defense: Classical Variation, Milner-Barry Variation",1
Indian Game: Dzindzi-Indian Defense,1
Grob Opening: Keene Defense,1
"Four Knights Game: Scotch Variation, Schmid Defense",1
"Nimzo-Indian Defense: Normal Variation, Huebner Deferred",1
"King's Pawn Game: Tayler Opening, Inverted Hanham",1
Zukertort Opening: The Walrus,1
Scotch Game: Horwitz Attack,1
"Nimzowitsch Defense: Scandinavian Variation, Bogoljubov Variation, Nimzowitsch Gambit",1
"Queen's Indian Defense: Kasparov-Petrosian Variation, Main Line",1
"Sicilian Defense: Alapin Variation, Barmen Defense, Endgame Variation",1
"Neo-Gruenfeld Defense, with 5.Nf3",1
"Vienna Game: Vienna Gambit, Cunningham Defense",1
Nimzo-Larsen Attack: Pachman Gambit,1
"English Opening: Anglo-Indian Defense, Nimzo-English",1
King's Indian Defense: Averbakh Variation,1
"King's Gambit Accepted, Muzio Gambit, Wild Muzio Gambit",1
Vienna Game: Giraffe Attack,1
"Reti Opening: Advance Variation, Michel Gambit",1
"King's Gambit Accepted, Greco Gambit",1
"Queen's Gambit Declined: Semi-Slav, Abrahams Variation",1
"Italian Game: Evans Gambit, Pierce Defense",1
"Sicilian Defense: Richter-Rauzer Variation, Neo-Modern Variation, Early Deviations",1
"Ruy Lopez: Berlin Defense, Rio de Janeiro Variation",1
"French Defense: Tarrasch Variation, Open System, Main Line",1
